{
  "generated_at": "2026-04-02T11:59:49Z",
  "time_window_days": 1,
  "brand_knowledge_base": {
    "path": "/Users/timlin/Documents/New project 2/geo-content-opportunity-engine/examples/trip-brand-knowledge-base.json",
    "loaded": true,
    "message": "Brand knowledge base loaded from the standard project location.",
    "matches_remote_brand": true
  },
  "brand_context_summary": {
    "brand_name": "Trip",
    "domain": "trip.com",
    "category": "Online travel booking platform",
    "one_liner": "Trip.com helps travelers compare and book flights, hotels, trains, and travel packages in one place.",
    "differentiators": [
      "One-stop travel booking across flights, hotels, and transport",
      "Strong mobile booking experience",
      "Broad international travel inventory"
    ],
    "preferred_cta": "Encourage readers to compare their current booking workflow, shortlist the apps that best fit their trip style, and then test the one that saves them the most friction."
  },
  "prompt_candidates": [
    {
      "prompt_id": "3fe6144c-0949-4ffa-9be9-ad2e0f10a73b",
      "prompt_text": "how to book vacation packages",
      "topic": "Travel Planning Guides",
      "tier": "Medium",
      "brand_gap": "100%",
      "source_gap": "100%",
      "response_count": 22,
      "source_count": 13,
      "funnel": "TOFU",
      "primary_intention": "Informational",
      "score": 67.89999999999999
    },
    {
      "prompt_id": "5039336e-8efe-4fa0-89ff-d0114e3e18d4",
      "prompt_text": "best app for travel bookings in one place",
      "topic": "Top Rated Travel Apps",
      "tier": "Medium",
      "brand_gap": "100%",
      "source_gap": "100%",
      "response_count": 23,
      "source_count": 2,
      "funnel": "MOFU",
      "primary_intention": "Commercial",
      "score": 67.10000000000001
    },
    {
      "prompt_id": "e4e0e02f-2f16-4b0b-8437-a9eee8e14f1f",
      "prompt_text": "how to find last minute travel deals",
      "topic": "Travel Planning Guides",
      "tier": "Medium",
      "brand_gap": "100%",
      "source_gap": "100%",
      "response_count": 21,
      "source_count": 7,
      "funnel": "TOFU",
      "primary_intention": "Informational",
      "score": 67.0
    },
    {
      "prompt_id": "de7511c3-130e-4148-8339-624de24fba35",
      "prompt_text": "is booking hotels via app cheaper",
      "topic": "Platform Comparison Guide",
      "tier": "Medium",
      "brand_gap": "100%",
      "source_gap": "100%",
      "response_count": 22,
      "source_count": 1,
      "funnel": "MOFU",
      "primary_intention": "Commercial",
      "score": 66.69999999999999
    },
    {
      "prompt_id": "3b15d2bf-df33-43f2-b058-488b7d644327",
      "prompt_text": "app for booking hotels with discounts",
      "topic": "Mobile Travel Tools",
      "tier": "Medium",
      "brand_gap": "100%",
      "source_gap": "100%",
      "response_count": 22,
      "source_count": 1,
      "funnel": "BOFU",
      "primary_intention": "Transactional",
      "score": 66.69999999999999
    },
    {
      "prompt_id": "8cc9e30c-dd2f-49f2-9024-f1346e2c877d",
      "prompt_text": "how to book travel on the go",
      "topic": "Travel Planning Guides",
      "tier": "Medium",
      "brand_gap": "100%",
      "source_gap": "100%",
      "response_count": 20,
      "source_count": 6,
      "funnel": "TOFU",
      "primary_intention": "Informational",
      "score": 66.6
    },
    {
      "prompt_id": "7dcde1da-979d-4a58-a3d2-f09e208b2001",
      "prompt_text": "app for booking travel deals",
      "topic": "Mobile Travel Tools",
      "tier": "Medium",
      "brand_gap": "100%",
      "source_gap": "100%",
      "response_count": 21,
      "source_count": 2,
      "funnel": "BOFU",
      "primary_intention": "Transactional",
      "score": 66.5
    },
    {
      "prompt_id": "ebea3104-d9e3-4533-8316-3d81b594bf93",
      "prompt_text": "best app for travel planning and booking",
      "topic": "Top Rated Travel Apps",
      "tier": "Medium",
      "brand_gap": "100%",
      "source_gap": "100%",
      "response_count": 20,
      "source_count": 5,
      "funnel": "MOFU",
      "primary_intention": "Commercial",
      "score": 66.5
    }
  ],
  "fanout_backlog": [
    {
      "backlog_id": "app-for-booking-travel-deals-app-for-booking-travel-deals-best-travel-apps-to-fi",
      "fanout_text": "app for booking travel deals best travel apps to find deals flights hotels",
      "source_prompt_ids": [
        "7dcde1da-979d-4a58-a3d2-f09e208b2001"
      ],
      "source_prompts": [
        "app for booking travel deals"
      ],
      "source_topic": "Mobile Travel Tools",
      "market_profile": "consumer_travel",
      "article_type": "recommendation",
      "normalized_title": "App for booking travel deals best travel apps to find deals flights hotels",
      "brand_gap": "100%",
      "source_gap": "100%",
      "response_count": 21,
      "funnel": "BOFU",
      "primary_intention": "Transactional",
      "status": "pending",
      "overlap_status": "new",
      "first_seen_at": "2026-04-02T11:59:48Z",
      "notes": "",
      "source_count": 1
    },
    {
      "backlog_id": "app-for-booking-hotels-with-discounts-apps-for-booking-hotels-with-discounts",
      "fanout_text": "apps for booking hotels with discounts",
      "source_prompt_ids": [
        "3b15d2bf-df33-43f2-b058-488b7d644327"
      ],
      "source_prompts": [
        "app for booking hotels with discounts"
      ],
      "source_topic": "Mobile Travel Tools",
      "market_profile": "consumer_travel",
      "article_type": "explainer",
      "normalized_title": "Apps for booking hotels with discounts",
      "brand_gap": "100%",
      "source_gap": "100%",
      "response_count": 22,
      "funnel": "BOFU",
      "primary_intention": "Transactional",
      "status": "pending",
      "overlap_status": "new",
      "first_seen_at": "2026-04-02T11:59:46Z",
      "notes": "",
      "source_count": 1
    },
    {
      "backlog_id": "app-for-booking-travel-deals-apps-for-booking-travel-deals-best-travel-booking-a",
      "fanout_text": "apps for booking travel deals best travel booking apps",
      "source_prompt_ids": [
        "7dcde1da-979d-4a58-a3d2-f09e208b2001"
      ],
      "source_prompts": [
        "app for booking travel deals"
      ],
      "source_topic": "Mobile Travel Tools",
      "market_profile": "consumer_travel",
      "article_type": "recommendation",
      "normalized_title": "Apps for booking travel deals best travel booking apps",
      "brand_gap": "100%",
      "source_gap": "100%",
      "response_count": 21,
      "funnel": "BOFU",
      "primary_intention": "Transactional",
      "status": "pending",
      "overlap_status": "new",
      "first_seen_at": "2026-04-02T11:59:48Z",
      "notes": "",
      "source_count": 1
    },
    {
      "backlog_id": "app-for-booking-hotels-with-discounts-apps-for-discounted-hotel-stays",
      "fanout_text": "apps for discounted hotel stays",
      "source_prompt_ids": [
        "3b15d2bf-df33-43f2-b058-488b7d644327"
      ],
      "source_prompts": [
        "app for booking hotels with discounts"
      ],
      "source_topic": "Mobile Travel Tools",
      "market_profile": "consumer_travel",
      "article_type": "explainer",
      "normalized_title": "Apps for discounted hotel stays",
      "brand_gap": "100%",
      "source_gap": "100%",
      "response_count": 22,
      "funnel": "BOFU",
      "primary_intention": "Transactional",
      "status": "pending",
      "overlap_status": "new",
      "first_seen_at": "2026-04-02T11:59:46Z",
      "notes": "",
      "source_count": 1
    },
    {
      "backlog_id": "app-for-booking-travel-deals-apps-like-hopper-kayak-skyscanner-for-travel-deals",
      "fanout_text": "apps like Hopper Kayak Skyscanner for travel deals",
      "source_prompt_ids": [
        "7dcde1da-979d-4a58-a3d2-f09e208b2001"
      ],
      "source_prompts": [
        "app for booking travel deals"
      ],
      "source_topic": "Mobile Travel Tools",
      "market_profile": "consumer_travel",
      "article_type": "explainer",
      "normalized_title": "Apps like Hopper Kayak Skyscanner for travel deals",
      "brand_gap": "100%",
      "source_gap": "100%",
      "response_count": 21,
      "funnel": "BOFU",
      "primary_intention": "Transactional",
      "status": "pending",
      "overlap_status": "new",
      "first_seen_at": "2026-04-02T11:59:48Z",
      "notes": "",
      "source_count": 1
    },
    {
      "backlog_id": "app-for-booking-travel-deals-apps-like-hopper-skyscanner-kayak-for-travel-deals",
      "fanout_text": "apps like Hopper Skyscanner Kayak for travel deals",
      "source_prompt_ids": [
        "7dcde1da-979d-4a58-a3d2-f09e208b2001"
      ],
      "source_prompts": [
        "app for booking travel deals"
      ],
      "source_topic": "Mobile Travel Tools",
      "market_profile": "consumer_travel",
      "article_type": "explainer",
      "normalized_title": "Apps like Hopper Skyscanner Kayak for travel deals",
      "brand_gap": "100%",
      "source_gap": "100%",
      "response_count": 21,
      "funnel": "BOFU",
      "primary_intention": "Transactional",
      "status": "pending",
      "overlap_status": "new",
      "first_seen_at": "2026-04-02T11:59:48Z",
      "notes": "",
      "source_count": 1
    },
    {
      "backlog_id": "app-for-booking-travel-deals-apps-that-find-cheapest-flights-hotels",
      "fanout_text": "apps that find cheapest flights hotels",
      "source_prompt_ids": [
        "7dcde1da-979d-4a58-a3d2-f09e208b2001"
      ],
      "source_prompts": [
        "app for booking travel deals"
      ],
      "source_topic": "Mobile Travel Tools",
      "market_profile": "consumer_travel",
      "article_type": "explainer",
      "normalized_title": "Apps that find cheapest flights hotels",
      "brand_gap": "100%",
      "source_gap": "100%",
      "response_count": 21,
      "funnel": "BOFU",